<?xml version="1.0" encoding="UTF-8"?>
<hospital xmlns:xsi="http://www.w3.org/2001/XMLSchema-instance"
          xsi:noNamespaceSchemaLocation="hospital.xsd">

    <patient id="1">
        <name>Uwimana Aline</name>
        <gender>Female</gender>
        <dob>1992-06-15</dob>
        <phone>0781234567</phone>

        <records>
            <record>
                <visitDate>2025-01-10</visitDate>
                <doctor>Dr. Mukamana</doctor>
                <diagnosis>Malaria</diagnosis>
                <treatment>Antimalarial therapy</treatment>
                <prescriptions>
                    <medicine>Coartem</medicine>
                </prescriptions>
                <billing>
                    <consultationFee>5000</consultationFee>
                    <medicationCost>3000</medicationCost>
                    <totalCost>8000</totalCost>
                </billing>
            </record>
        </records>
    </patient>

    <patient id="2">
        <name>Habimana Eric</name>
        <gender>Male</gender>
        <dob>1988-03-22</dob>
        <phone>0798765432</phone>

        <records>
            <record>
                <visitDate>2025-02-05</visitDate>
                <doctor>Dr. Niyonzima</doctor>
                <diagnosis>Typhoid</diagnosis>
                <treatment>Antibiotics</treatment>
                <prescriptions>
                    <medicine>Ciprofloxacin</medicine>
                </prescriptions>
                <billing>
                    <consultationFee>7000</consultationFee>
                    <medicationCost>4000</medicationCost>
                    <totalCost>11000</totalCost>
                </billing>
            </record>
        </records>
    </patient>

    <patient id="3">
        <name>Uwase Diane</name>
        <gender>Female</gender>
        <dob>2000-11-30</dob>
        <phone>0785551234</phone>

        <records>
            <record>
                <visitDate>2025-02-20</visitDate>
                <doctor>Dr. Uwizeye</doctor>
                <diagnosis>Respiratory Infection</diagnosis>
                <treatment>Antibiotics and rest</treatment>
                <prescriptions>
                    <medicine>Amoxicillin</medicine>
                </prescriptions>
                <billing>
                    <consultationFee>6000</consultationFee>
                    <medicationCost>3500</medicationCost>
                    <totalCost>9500</totalCost>
                </billing>
            </record>
        </records>
    </patient>

    <patient id="4">
        <name>Ndayisaba Jean</name>
        <gender>Male</gender>
        <dob>1995-08-12</dob>
        <phone>0791122334</phone>

        <records>
            <record>
                <visitDate>2025-03-01</visitDate>
                <doctor>Dr. Nsengimana</doctor>
                <diagnosis>Gastritis</diagnosis>
                <treatment>Diet control and medication</treatment>
                <prescriptions>
                    <medicine>Omeprazole</medicine>
                </prescriptions>
                <billing>
                    <consultationFee>5000</consultationFee>
                    <medicationCost>2500</medicationCost>
                    <totalCost>7500</totalCost>
                </billing>
            </record>
        </records>
    </patient>

</hospital>